{
  "$schema": "./schema.json",
  "capturedAt": "2026-06-03T17:10:07.108Z",
  "monitorVersion": "2b0be7b",
  "sdkVersion": "^0.2.2",
  "model": "claude-opus-4.6",
  "experiments": {
    "context-tax": {
      "name": "context-tax",
      "description": "Measures character/token overhead of CLI wrapper layer components",
      "metrics": {
        "systemPromptChars": {
          "value": 183547,
          "unit": "chars",
          "description": "System prompt length in characters"
        },
        "systemPromptTokensEstimated": {
          "value": 45887,
          "unit": "tokens",
          "description": "Estimated token count of system prompt (÷4 heuristic)"
        },
        "toolDefinitionsChars": {
          "value": 2892,
          "unit": "chars",
          "description": "Combined length of all tool definitions serialized as JSON"
        },
        "toolDefinitionsTokensEstimated": {
          "value": 723,
          "unit": "tokens",
          "description": "Estimated token count of tool definitions (÷4 heuristic)"
        },
        "toolCount": {
          "value": 15,
          "unit": "tools",
          "description": "Number of registered tool definitions"
        },
        "avgCharsPerTool": {
          "value": 174,
          "unit": "chars",
          "description": "Average characters per tool definition"
        },
        "totalOverheadChars": {
          "value": 186439,
          "unit": "chars",
          "description": "Total wrapper overhead in characters"
        },
        "totalOverheadTokensEstimated": {
          "value": 46610,
          "unit": "tokens",
          "description": "Total estimated token overhead from system prompt + tool definitions"
        }
      },
      "rawData": {
        "mode": "static",
        "liveAvailable": true,
        "note": "Pass liveMode: true to enable exact token counts.",
        "perToolChars": [
          {
            "name": "load_csv",
            "chars": 145
          },
          {
            "name": "read_channel_history",
            "chars": 281
          },
          {
            "name": "read_instruction",
            "chars": 218
          },
          {
            "name": "manage_agents",
            "chars": 130
          },
          {
            "name": "test-agent",
            "chars": 49
          },
          {
            "name": "manage_mcp",
            "chars": 105
          },
          {
            "name": "manage_tasks",
            "chars": 125
          },
          {
            "name": "recall_memory",
            "chars": 254
          },
          {
            "name": "pipeline_add",
            "chars": 387
          },
          {
            "name": "begin_plan",
            "chars": 180
          },
          {
            "name": "autogent-playwright",
            "chars": 127
          },
          {
            "name": "send_file",
            "chars": 146
          },
          {
            "name": "skill_manage",
            "chars": 98
          },
          {
            "name": "spawn_task",
            "chars": 121
          },
          {
            "name": "web_search",
            "chars": 239
          }
        ]
      }
    }
  },
  "binaryHash": "sha256:2ce57cb28adc008d83fd61910c5005b32640efc974bbe3db2db4bc72bde57486",
  "systemPromptHash": "sha256:34d0c6a33fd04c47657a5a20706ed9ab43f04f7e3ee54c561b54f2e222a3cd7c"
}